Sinopharm/Beijing,China,Approved,2,Combination,Yes,Bio Pharma,Indonesia,15.000,Jun-21,Not available,,Indonesia,East Asia & Pacific,Upper middle income," 4,050.00 "," 1,097,222,981,867.23 "," 270,625,568.00 ",270.63,0.055,2.77%,"The purchase agreement is part of Indonesia's drive to allow private vaccinations. The state-owned Bio-Pharma has announced the purchase agreements, and private companies can buy the vaccine from them. There has also been reporting of a purchase for 15m doses where it is unclear if Bio-Pharma is involved, and that another 50m doses are planned in 2021, but this has not been confirmed. Higher doses are reported as part of the manufacturing arrangement.",https://www.reuters.com/article/us-health-coronavirus-indonesia-vaccine/indonesia-orders-20-million-covid-19-vaccine-doses-for-private-inoculations-idUSKBN2B70LV ; https://www.reuters.com/article/us-health-coronavirus-indonesia-vaccines-idUSKBN2AH11A
Sinovac,China,Approved,2,Private Donation,Yes,,,0.050,,Not available,,CONMEBOL,#N/A,#N/A,#N/A,#N/A,#N/A,#N/A,#N/A,#N/A,"Sinovac has donated 50,000 doses to the South American Football Confederation (CONMEBOL) for national teams in advace of the Copa America. ",https://www.espn.com/soccer/copa-america/story/4359042/chinese-company-donates-50k-covid-vaccines-to-conmebol-ahead-of-copa-america
,China,#N/A,#N/A,Other,Yes,,,,,Not available,#VALUE!,International Olympic Committee,#N/A,#N/A,#N/A,#N/A,#N/A,#N/A,#N/A,#N/A,"Details are scant, but there are reports that the International Olympic Committee will purchase vaccine doses for athletes from China. Not clear how many doses or which vaccine will be used. ",https://apnews.com/article/beijing-thomas-bach-tokyo-coronavirus-pandemic-2020-tokyo-olympics-a4906bfe5df1cb45549cb0b5ffd5a54f
Bharat Biotech,India,Approved,2,Government Purchase,Yes,,,0.500,Mar-21,Not available,,"Iran, Islamic rep.",Middle East & North Africa,Upper middle income," 5,300.00 "," 433,734,190,602.17 "," 82,913,906.00 ",82.91,0.006,0.30%,"News report do not mention if this is a purchase, but govt sources list it under commercial dispatch",https://www.livemint.com/science/health/150000-doses-of-bharat-biotech-s-covaxin-reaches-iran-11615461876905.html ; https://www.mea.gov.in/vaccine-supply.htm
Gamaleya,Russian Federation,Approved,2,Combination,Yes,,,62.000,Feb-21,604.50, 9.75 ,"Iran, Islamic rep.",Middle East & North Africa,Upper middle income," 5,300.00 "," 433,734,190,602.17 "," 82,913,906.00 ",82.91,0.748,37.39%,"The agreement is for purchase and joint production and reports note that two in-country manufacturers have concluded arrangements with the RDIF, but these companies have not been identified. Total anticipated production is not clear but Reuters has reported an initial contract for 2m doses, and a second contract for 60m doses that was announced April 15 2021. Anticipated eventual manufacturing production of 40m doses/year. Price based on RDIF statements that the vaccine will be sold in all markets for 9.75/dose.",https://www.reuters.com/article/health-coronavirus-iran-vaccination-int/iran-starts-covid-vaccination-awaits-more-vaccine-deliveries-idUSKBN2A9120 ; https://tass.com/world/1250733 ; http://www.uniindia.com/news/world/health-iran-sputnik-vaccine/2326572.html ; https://www.rferl.org/a/iran-signs-deal-to-buy-60-million-sputnik-vaccine-doses-from-russia/31205682.html
AstraZeneca/Oxford,United Kingdom/Sweden,Approved,2,Government Purchase,Yes,,,2.000,,Not available,,Iraq,Middle East & North Africa,Upper middle income," 5,740.00 "," 225,739,218,618.46 "," 39,309,783.00 ",39.31,0.051,2.54%,,https://abcnews.go.com/Health/wireStory/iraq-launches-vaccine-program-arrival-china-doses-76200686
Gamaleya,Russian Federation,Approved,2,Government Purchase,Yes,,,1.000,Mar-21,9.75, 9.75 ,Iraq,Middle East & North Africa,Upper middle income," 5,740.00 "," 225,739,218,618.46 "," 39,309,783.00 ",39.31,0.025,1.27%,,https://www.reuters.com/article/health-coronavirus-iraq-vaccine-int/iraq-signs-deal-to-receive-russias-sputnik-v-vaccine-idUSKBN2AW1VZ
Pfizer/BioNTech,United States/Germany,Approved,2,Government Purchase,Yes,,,1.500,early 2021,Not available,,Iraq,Middle East & North Africa,Upper middle income," 5,740.00 "," 225,739,218,618.46 "," 39,309,783.00 ",39.31,0.038,1.91%,,https://www.reuters.com/article/idUSKBN28V2FU
Sinopharm/Beijing,China,Approved,2,Government Purchase,Yes,,,2.000,,Not available,,Iraq,Middle East & North Africa,Upper middle income," 5,740.00 "," 225,739,218,618.46 "," 39,309,783.00 ",39.31,0.051,2.54%,Health ministry announced the 2m arrangement while receiving a first batch of donations from China,https://www.arabnews.com/node/1818291/middle-east
Arcturus/Duke NUS,Singapore/United States,Phase 2,1,Government Purchase,Yes,,,4.000,,275.00, 68.75 ,Israel,Middle East & North Africa,High income," 43,110.00 "," 390,264,407,455.91 "," 9,053,300.00 ",9.05,0.442,44.18%,"Single dose. Deal reported as having a price of ""up to"" 275m USD.",https://www.jpost.com/health-science/israel-to-sign-agreement-with-vaccine-company-in-advanced-testing-stages-636132 ; https://www.cnbc.com/2020/11/27/singapore-arcturus-coronavirus-vaccine-candidate-on-track-for-2021-delivery.html
AstraZeneca/Oxford,United Kingdom/Sweden,Approved,2,Government Purchase,Yes,,,10.000,Starting May 2021,Not available,,Israel,Middle East & North Africa,High income," 43,110.00 "," 390,264,407,455.91 "," 9,053,300.00 ",9.05,1.105,55.23%,,https://www.jpost.com/breaking-news/astrazeneca-covid-19-vaccine-can-be-90-percent-effective-649957
Moderna,United States,Approved,2,Government Purchase,Yes,,,10.000,,Not available,,Israel,Middle East & North Africa,High income," 43,110.00 "," 390,264,407,455.91 "," 9,053,300.00 ",9.05,1.105,55.23%,"Israel reportedly struck new arrangments with Modern and Pfizer for a total of 16m doses, but not clear how many of each. Report by Reuters puts number of Moderna doses at 10m, greater than an earlier reported 6m. ",https://www.businesswire.com/news/home/20201204005331/en/Moderna-Announces-Amendment-to-Supply-Agreement-with-the-Ministry-of-Health-of-Israel-to-Supply-Additional-Doses-of-mRNA-Vaccine-Against-COVID-19-mRNA-1273 ; https://www.reuters.com/business/healthcare-pharmaceuticals/israel-buy-covid-19-variant-specific-vaccine-moderna-2021-04-20/
Pfizer/BioNTech,United States/Germany,Approved,2,Government Purchase,Yes,,,15.000,,352.50, 23.50 ,Israel,Middle East & North Africa,High income," 43,110.00 "," 390,264,407,455.91 "," 9,053,300.00 ",9.05,1.657,82.84%,Reported estimated price/dose is used to calculate total price. Reports indicate actual price may be even higher. ,https://www.timesofisrael.com/israel-has-spent-788m-on-vaccines-could-double-that-in-future-health-ministry/ ; https://www.timesofisrael.com/israel-seals-vaccine-deal-with-pfizer-amid-signs-pandemic-spreading-again/
Gamaleya,Russian Federation,Approved,2,Government Purchase,Yes,,,NA,,Not available, 9.75 ,Italy,Europe & Central Asia,High income," 34,530.00 "," 2,081,972,404,768.57 "," 60,297,396.00 ",60.30,#VALUE!,#VALUE!,Deal signed by the Campania region and is subject to EMA approval of the vaccine. Price based on statements that Gamaleya is charging the 9.75/dose in all markets.,https://www.reuters.com/article/us-health-coronavirus-italy-sputnik/italys-campania-region-signs-deal-to-buy-russias-sputnik-v-vaccine-idUSKBN2BI2I6
AstraZeneca/Oxford,United Kingdom/Sweden,Approved,2,Combination,Yes,JCR Pharma,Japan,120.000,30 m by March of 2021,Not available,,Japan,East Asia & Pacific,High income," 41,710.00 "," 5,266,925,796,679.99 "," 126,264,931.00 ",126.26,0.950,47.52%,JCR pharma has been licensed to make 90m while the other 30m will be provided by AstraZeneca produced overseas,https://asia.nikkei.com/Spotlight/Coronavirus/Japan-to-produce-90m-doses-of-AstraZeneca-COVID-19-vaccine; https://s3.amazonaws.com/one.org/vaccine-access-test/ONE_VAT_deal_AstraZeneca_Japan.pdf
Moderna,United States,Approved,2,Government Purchase,Yes,Takeda [distributor],Japan,50.000,,Not available,,Japan,East Asia & Pacific,High income," 41,710.00 "," 5,266,925,796,679.99 "," 126,264,931.00 ",126.26,0.396,19.80%,,https://investors.modernatx.com/news-releases/news-release-details/moderna-partners-takeda-and-government-japan-supply-50-million
Pfizer/BioNTech,United States/Germany,Approved,2,Government Purchase,Yes,,,144.000,,Not available,,Japan,East Asia & Pacific,High income," 41,710.00 "," 5,266,925,796,679.99 "," 126,264,931.00 ",126.26,1.140,57.02%,"Most early sources report 120 million doses, but multiple more recent sources report 144 million doses through the end of 2021",https://asia.nikkei.com/Spotlight/Coronavirus/Japan-to-produce-90m-doses-of-AstraZeneca-COVID-19-vaccine; https://www.pfizer.com/news/press-release/press-release-detail/pfizer-and-biontech-supply-japan-120-million-doses-their ; https://s3.amazonaws.com/one.org/vaccine-access-test/ONE_VAT_deal_Pfizer-BioNTech_Japan.pdf
AstraZeneca/Oxford,United Kingdom/Sweden,Approved,2,Government Purchase,Yes,,,2.000,,Not available,,Jordan,Middle East & North Africa,Upper middle income," 4,410.00 "," 44,542,115,024.96 "," 10,101,694.00 ",10.10,0.198,9.90%,Details of the arrangement are few and the doses have only been reported by ArabNews,https://www.arabnews.com/node/1828091/middle-east
Gamaleya,Russian Federation,Approved,2,Government Purchase,Yes,,,2.000,,Not available,,Jordan,Middle East & North Africa,Upper middle income," 4,410.00 "," 44,542,115,024.96 "," 10,101,694.00 ",10.10,0.198,9.90%,Details of the arrangement are few and the doses have only been reported by ArabNews,https://www.arabnews.com/node/1828091/middle-east
Pfizer/BioNTech,United States/Germany,Approved,2,Government Purchase,Yes,,,1.000,,Not available,,Jordan,Middle East & North Africa,Upper middle income," 4,410.00 "," 44,542,115,024.96 "," 10,101,694.00 ",10.10,0.099,4.95%,,https://www.reuters.com/article/us-health-coronavirus-jordan-vaccine-idUSKBN2980IW
Sinopharm/Beijing,China,Approved,2,Government Purchase,Yes,,,2.000,,Not available,,Jordan,Middle East & North Africa,Upper middle income," 4,410.00 "," 44,542,115,024.96 "," 10,101,694.00 ",10.10,0.198,9.90%,Details of the arrangement are few and the doses have only been reported by ArabNews,https://www.arabnews.com/node/1828091/middle-east
Gamaleya,Russian Federation,Approved,2,Government Purchase,Yes,,,2.000,,19.50, 9.75 ,Kazakhstan,Europe & Central Asia,Upper middle income," 8,820.00 "," 163,361,260,005.36 "," 18,513,930.00 ",18.51,0.108,5.40%,"Deal between the Russian Direct Investment Fund and SK Pharmacy, the Kazakh government's pharmaceutical distributor. Pricing based on general statements from RDIF that that price/dose of 9.75 USD is ""the same for all markets.""",https://thediplomat.com/2020/08/kazakhstan-settles-deal-with-russia-for-vaccine-supply/ ; https://www.ft.com/content/ffe40c7d-c418-4a93-a202-5ee996434de7
Research Institute for Biological Safety Problems,Kazakhstan,Phase 3,2,Government Purchase,Yes,,,0.050,,Not available,,Kazakhstan,Europe & Central Asia,Upper middle income," 8,820.00 "," 163,361,260,005.36 "," 18,513,930.00 ",18.51,0.003,0.14%,Kazakhstan started the roll out of its domestically produced QazVac vaccine in Apr 2021 with 0.05m doses sent to various parts. More doses are expected to be produced but the total doses purchased by the government has not been made public. Vaccine is still in Phase 2/3 trials.,https://www.reuters.com/business/healthcare-pharmaceuticals/kazakhstan-rolls-out-its-own-covid-19-vaccine-2021-04-27/
Pfizer/BioNTech,United States/Germany,Approved,2,Government Purchase,Yes,,,NA,,Not available,,Kazakhstan,Europe & Central Asia,Upper middle income," 8,820.00 "," 163,361,260,005.36 "," 18,513,930.00 ",18.51,#VALUE!,#VALUE!,,https://in.reuters.com/article/health-coronavirus-kazakhstan-pfizer-idINKBN2920UZ
Sinopharm/Beijing,China,Approved,2,Government Purchase,Yes,,,1.000,,Not available,,Kazakhstan,Europe & Central Asia,Upper middle income," 8,820.00 "," 163,361,260,005.36 "," 18,513,930.00 ",18.51,0.054,2.70%,,https://www.reuters.com/business/healthcare-pharmaceuticals/kazakhstan-rolls-out-its-own-covid-19-vaccine-2021-04-27/
AstraZeneca/Oxford,United Kingdom/Sweden,Approved,2,Government Purchase,Yes,,,3.000,Feb-21,Not available,,Kuwait,Middle East & North Africa,High income," 33,590.00 "," 138,985,371,643.86 "," 4,207,083.00 ",4.21,0.713,35.65%,,https://gulfnews.com/world/gulf/kuwait/kuwait-no-choosing-between-vaccines-health-officials-say-1.76376908 ; https://www.arabnews.com/node/1800566/middle-east
Pfizer/BioNTech,United States/Germany,Approved,2,Government Purchase,Yes,,,1.000,,Not available,,Kuwait,Middle East & North Africa,High income," 33,590.00 "," 138,985,371,643.86 "," 4,207,083.00 ",4.21,0.238,11.88%,,https://gulfnews.com/world/gulf/kuwait/covid-19-kuwait-to-get-1-million-pfizer-vaccines-doses-by-end-of-2020-1.75190616
AstraZeneca/Oxford,United Kingdom/Sweden,Approved,2,Government Purchase,No,R-Pharm,Russian Federation,1.500,Apr-21,Not available,,Lebanon,Middle East & North Africa,Upper middle income," 7,380.00 "," 50,560,914,393.79 "," 6,855,713.00 ",6.86,0.219,10.94%,Arrangement not yet finalized,https://www.moph.gov.lb/en/Pages/127/48209/
Gamaleya,Russian Federation,Approved,2,Private Purchase,Yes,,,1.000,Mar-21,9.75,9.75,Lebanon,Middle East & North Africa,Upper middle income," 7,380.00 "," 50,560,914,393.79 "," 6,855,713.00 ",6.86,0.146,7.29%,Not clear which company has purchased these vaccines for sale in Lebanon. The vaccine will be sold to individuals in Lebanon at a price of 38 USD for the two doses. Total price based on reports that Gamaleya is charging 9.75/dose in all markets.,https://apnews.com/article/lebanon-coronavirus-pandemic-russia-financial-markets-coronavirus-vaccine-b81a58fa49d276315c5b6fed0ef8fe53
Gamaleya,Russian Federation,Approved,2,Government Purchase,No,,,1.000,,9.75, 9.75 ,Lebanon,Middle East & North Africa,Upper middle income," 7,380.00 "," 50,560,914,393.79 "," 6,855,713.00 ",6.86,0.146,7.29%,Arrangement not yet finalized,https://www.moph.gov.lb/en/Pages/127/48209/
Pfizer/BioNTech,United States/Germany,Approved,2,Government Purchase,Yes,,,2.100,,37.80, 18.00 ,Lebanon,Middle East & North Africa,Upper middle income," 7,380.00 "," 50,560,914,393.79 "," 6,855,713.00 ",6.86,0.306,15.32%,Price based price/dose reported by Lebanese lawmaker. To be financed primarily by a World Bank loan.,https://www.reuters.com/article/idUSKBN29213T ; https://www.arabnews.com/node/1794071/middle-east
Gamaleya,Russian Federation,Approved,2,Government Purchase,Unclear,,,0.100,,0.98, 9.75 ,Libya,Middle East & North Africa,Upper middle income," 7,640.00 "," 51,755,222,833.29 "," 6,777,452.00 ",6.78,0.015,0.74%,A delivery of 0.1m doses has been reported. African Weekly mentions that it is unclear if the doses have already been paid for. XinhuaNet mentions that Libya expects a total of 5m doses but this is not reported anywhere else.,https://thearabweekly.com/libya-finally-receives-first-covid-vaccines ; http://www.xinhuanet.com/english/africa/2021-04/05/c_139858648.htm
AstraZeneca/Oxford,United Kingdom/Sweden,Approved,2,Government Purchase,Yes,,,NA,,Not available,,"Macao SAR, China",East Asia & Pacific,High income, .. ," 49,673,360,578.64 "," 640,445.00 ",0.64,#VALUE!,#VALUE!,"Final doses secured is unclear, but official sources state that this is one of the 3 vaccines made available in the country. No information is doses is available yet.",https://www.ssm.gov.mo/apps1/covid19vaccine/en.aspx#clg18772
Pfizer/BioNTech,United States/Germany,Approved,2,Government Purchase,Yes,Fosun Pharma,China,NA,,Not available,,"Macao SAR, China",East Asia & Pacific,High income, .. ," 49,673,360,578.64 "," 640,445.00 ",0.64,#VALUE!,#VALUE!,"Final doses secured is unclear, but official sources state that this is one of the 3 vaccines made available in the country. Fosun's official press release mentions that deal may include up to 40m doses.",https://www.ssm.gov.mo/apps1/covid19vaccine/en.aspx#clg18772 ; https://www.fosunpharma.com/en/news/news-details-3828.html
Sinopharm/Beijing,China,Approved,2,Government Purchase,Yes,,,0.100,,Not available,,"Macao SAR, China",East Asia & Pacific,High income, .. ," 49,673,360,578.64 "," 640,445.00 ",0.64,0.156,7.81%,"Final doses secured is unclear, but official sources state that this is one of the 3 vaccines made available in the country. Macau has already received 0.1m doses",https://www.ssm.gov.mo/apps1/covid19vaccine/en.aspx#clg18772
AstraZeneca/Oxford,United Kingdom/Sweden,Approved,2,Government Purchase,Yes,,,6.400,,Not available,,Malaysia,East Asia & Pacific,Upper middle income," 11,230.00 "," 358,835,301,422.96 "," 31,949,777.00 ",31.95,0.200,10.02%,"Pricing is unclear, but it has been reported that Malaysia is expected to spend 504.4 million USD on all vaccine deals",https://www.reuters.com/article/health-coronavirus-malaysia/malaysia-buys-astrazeneca-covid-19-vaccines-seeks-more-from-china-russia-idUSKBN28W09K
CanSino Biologics,China,Approved,1,Government Purchase,Yes,,,3.500,,Not available,,Malaysia,East Asia & Pacific,Upper middle income," 11,230.00 "," 358,835,301,422.96 "," 31,949,777.00 ",31.95,0.110,10.95%,,https://www.reuters.com/article/health-coronavirus-malaysia/malaysia-buys-astrazeneca-covid-19-vaccines-seeks-more-from-china-russia-idUSKBN28W09K
Gamaleya,Russian Federation,Approved,2,Combination,Yes,Duopharma,Malaysia,6.400,From March 2021,62.40, 9.75 ,Malaysia,East Asia & Pacific,Upper middle income," 11,230.00 "," 358,835,301,422.96 "," 31,949,777.00 ",31.95,0.200,10.02%,"Pricing based on general statements from RDIF that that price/dose of 9.75 USD is ""the same for all markets."" Duopharma will conduct fill-and-finish and distribution.",https://www.reuters.com/article/us-health-coronavirus-malaysia-vaccines/malaysia-secures-18-4-million-doses-of-russian-chinese-covid-19-vaccines-idUSKBN29V11H ; https://www.reuters.com/article/health-coronavirus-malaysia/malaysia-buys-astrazeneca-covid-19-vaccines-seeks-more-from-china-russia-idUSKBN28W09K ; https://www.reuters.com/article/us-health-coronavirus-malaysia-vaccines-idUSKBN29V11H ; https://www.ft.com/content/ffe40c7d-c418-4a93-a202-5ee996434de7
Pfizer/BioNTech,United States/Germany,Approved,2,Government Purchase,Yes,,,32.000,,Not available,,Malaysia,East Asia & Pacific,Upper middle income," 11,230.00 "," 358,835,301,422.96 "," 31,949,777.00 ",31.95,1.002,50.08%,"Most recent update from March says Malaysia is buying additional doses, bringing its total to 32m",https://www.reuters.com/article/us-health-coronavirus-malaysia-vaccine/malaysia-to-buy-more-pfizer-biontech-vaccine-doses-bringing-total-secured-to-32-million-idUSKBN2B00DU ; https://www.theedgemarkets.com/article/khairy-govts-covid19-vaccine-deal-only-pfizer-and-covax-others-are-private-arrangements ; https://www.reuters.com/article/idUSL1N2ID0FL
Sinovac,China,Approved,2,Government Purchase,Yes,Pharmaniaga Berhad [distributor],,0.200,Mar-21,Not available,,Malaysia,East Asia & Pacific,Upper middle income," 11,230.00 "," 358,835,301,422.96 "," 31,949,777.00 ",31.95,0.006,0.31%,Pharmaniaga Berhad will import the finished doses and supply to the govt. This is separate from the existing manufacturing agreement,https://www.theedgemarkets.com/article/pharmaniaga-inks-agreement-govt-distribute-200000-imported-finished-sinovac-covid19-vaccines
Sinovac,China,Approved,2,Combination,Yes,Pharmaniaga Berhad,Malaysia,12.000,From April 2021,Not available,,Malaysia,East Asia & Pacific,Upper middle income," 11,230.00 "," 358,835,301,422.96 "," 31,949,777.00 ",31.95,0.376,18.78%,"Pharmaniaga will conduct fill-and-finish at first, then manufacture locally. Pharmaniaga has signed a deal for 14m doses, but the deal for sale to the government is for 12m; not clear what is happening with remaining 2m doses.",https://www.reuters.com/article/us-health-coronavirus-malaysia-vaccines/malaysia-secures-18-4-million-doses-of-russian-chinese-covid-19-vaccines-idUSKBN29V11H; https://www.reuters.com/article/health-coronavirus-malaysia/malaysia-buys-astrazeneca-covid-19-vaccines-seeks-more-from-china-russia-idUSKBN28W09K ; https://www.reuters.com/article/us-health-coronavirus-malaysia-sinovac-idUSKBN29H0M5
AstraZeneca/Oxford,United Kingdom/Sweden,Approved,2,Government Purchase,Yes,Serum Institute,India,0.700,,Not available,,Maldives,South Asia,Upper middle income," 9,680.00 "," 5,137,430,107.16 "," 530,953.00 ",0.53,1.318,65.92%,,https://covid19.health.gov.mv/vaccination/?c=0
AstraZeneca/Oxford,United Kingdom/Sweden,Approved,2,Government Purchase,Yes,,,0.101,Feb-21,Not available,,Mauritius,Sub-Saharan Africa,High income," 12,900.00 "," 16,322,003,287.70 "," 1,265,711.00 ",1.27,0.080,3.99%,,https://www.mea.gov.in/vaccine-supply.htm
Bharat Biotech,India,Approved,2,Government Purchase,Yes,,,0.200,Mar-21,Not available,,Mauritius,Sub-Saharan Africa,High income," 12,900.00 "," 16,322,003,287.70 "," 1,265,711.00 ",1.27,0.158,7.90%,,https://www.mea.gov.in/vaccine-supply.htm
AstraZeneca/Oxford,United Kingdom/Sweden,Approved,2,Government Purchase,Yes,Serum Institute,India,2.030,,8.12, 4.00 ,Mexico,Latin America & Caribbean,Upper middle income," 9,480.00 "," 1,209,833,679,979.64 "," 127,575,529.00 ",127.58,0.016,0.80%,2.03m doses confirmed by the govt source. Total price based on price/dose provided by the government source,https://www.gob.mx/sre/prensa/mexico-receives-shipment-of-870-000-doses-of-sars-cov-2-vaccine ; https://www.financialexpress.com/lifestyle/health/vaccine-maitri-diplomacy-more-latin-american-countries-to-get-covid-vaccine-doses-from-india/2194625/ ; https://thefederal.com/covid-19/mexico-to-import-8-7l-doses-of-serum-vaccine-from-india-says-president/
AstraZeneca/Oxford,United Kingdom/Sweden,Approved,2,Government Purchase,Yes,,,77.400,,Not available,,Mexico,Latin America & Caribbean,Upper middle income," 9,480.00 "," 1,209,833,679,979.64 "," 127,575,529.00 ",127.58,0.607,30.33%,,https://uk.reuters.com/article/us-health-coronavirus-mexico-vaccine/mexico-aims-to-vaccinate-vast-bulk-of-population-for-covid-19-by-end-2021-idINKBN26Y1R9
CanSino Biologics,China,Approved,1,Government Purchase,Yes,,,35.000,,Not available,,Mexico,Latin America & Caribbean,Upper middle income," 9,480.00 "," 1,209,833,679,979.64 "," 127,575,529.00 ",127.58,0.274,27.43%,CanSino is a one-dose vaccine,https://uk.reuters.com/article/us-health-coronavirus-mexico-vaccine/mexico-aims-to-vaccinate-vast-bulk-of-population-for-covid-19-by-end-2021-idINKBN26Y1R9
Curevac,Germany,Phase 3,2,Government Purchase,No,,,35.000,Apr-21,Not available,,Mexico,Latin America & Caribbean,Upper middle income," 9,480.00 "," 1,209,833,679,979.64 "," 127,575,529.00 ",127.58,0.274,13.72%,,https://www.reuters.com/article/health-coronavirus-mexico-vaccine/mexico-weighing-vaccine-proposals-from-moderna-four-other-companies-idUSKBN28P23K
Gamaleya,Russian Federation,Approved,2,Government Purchase,Yes,Landsteiner Pharmaceutical [distributor],Mexico,24.000,From November 2020,312.00, 9.75 ,Mexico,Latin America & Caribbean,Upper middle income," 9,480.00 "," 1,209,833,679,979.64 "," 127,575,529.00 ",127.58,0.188,9.41%,"Purchase agreement has been confirmed by the Mexican government and they have started receiving delivery of the vaccine. Earlier, Mexico's health ministry had denied that any deal had been reached (see second link). Pricing based on general statements from RDIF that that price/dose of 9.75 USD is ""the same for all markets."" There is some suggestion that there were separate agreements betweeen RDIF and Landsteiner for 32 m, followed by an agreement between Mexico and Landsteiner for 24m.",https://www.fdanews.com/articles/198943-landsteiner-scientific-to-distribute-russias-covid-19-vaccine-in-mexico ; https://www.theyucatantimes.com/2020/09/ministry-of-health-denies-arrival-of-sputnik-v-vaccine-in-mexico/ ; https://www.ft.com/content/ffe40c7d-c418-4a93-a202-5ee996434de7 ; https://www.urdupoint.com/en/world/rdif-provides-mexico-with-sputnik-v-vaccine-d-1111758.html ; https://www.gob.mx/sre/prensa/mexico-continues-its-strategy-of-securing-purchase-agreements-for-covid-19-vaccines?idiom=en ; https://www.gob.mx/sre/prensa/the-government-of-mexico-receives-first-200-000-doses-of-sputnik-v-covid-19-vaccine-from-russia
Moderna,United States,Approved,2,Government Purchase,No,,,39.000,Apr-21,Not available,,Mexico,Latin America & Caribbean,Upper middle income," 9,480.00 "," 1,209,833,679,979.64 "," 127,575,529.00 ",127.58,0.306,15.29%,,https://uk.reuters.com/article/health-coronavirus-mexico-vaccine/mexico-says-has-accord-with-pfizer-for-34-4-mln-coronavirus-vaccines-idUSS0N2EF00D
Novavax,United States,Phase 3,2,Government Purchase,No,,,10.000,Beginning June 2021,Not available,,Mexico,Latin America & Caribbean,Upper middle income," 9,480.00 "," 1,209,833,679,979.64 "," 127,575,529.00 ",127.58,0.078,3.92%,,https://www.reuters.com/article/health-coronavirus-mexico-vaccine/mexico-weighing-vaccine-proposals-from-moderna-four-other-companies-idUSKBN28P23K
Pfizer/BioNTech,United States/Germany,Approved,2,Government Purchase,Yes,,,34.400,,Not available,,Mexico,Latin America & Caribbean,Upper middle income," 9,480.00 "," 1,209,833,679,979.64 "," 127,575,529.00 ",127.58,0.270,13.48%,,https://uk.reuters.com/article/health-coronavirus-mexico-vaccine/mexico-says-has-accord-with-pfizer-for-34-4-mln-coronavirus-vaccines-idUSS0N2EF00D
