Vaccine candidate,Developer Location,Trial Phase,1 or 2 doses,Deal Type,Finalized Commitment,Manufacturer and/or Distributor,Manufacturer and/or Distributor Primary Location,Doses committed (in millions),Timeline at time of deal,Price (in USD million), Price/Dose (in USD) ,Buyer/recipient,Region,Income level," GNI per capita, Atlas method (current US$) "," GNI, Atlas method (current US$) ", Population ,Population size (millions),Doses/capita,Population covered,Notes,Sources
AstraZeneca/Oxford,United Kingdom/Sweden,Approved,2,Multilateral Purchase,Terminated,Serum Institute,India,500.000,At least 50 million doses will be available from April to June 2021,Not available,,African Union,0,Lower middle income," 1,822.20 "," 2,373,996,740,642.72 "," 1,302,819,408.00 ",1302.82,0.384,19.19%,"Arrangement terminated in April 2021; AU cited desire not to duplicate COVAX efforts. AU had purchased an additional 400m from the Serum Institute after the initial arrangement announced in January 2021. The first 100m doses were reported to cost 300m; it is unclear whether that price held for the additional 400m. GNI/population calculated without Saharawi due to lack of World Bank data. The data, however, includes Burundi and Tanzania - two countries which have refused COVID vaccines as of now.","https://www.reuters.com/article/uk-health-coronavirus-africa/african-union-drops-astrazeneca-vaccine-which-covax-will-supply-idUSKBN2BV14Y ; https://www.reuters.com/article/us-health-coronavirus-africa-idUSKBN29X1CE; https://www.news24.com/citypress/business/covid-19-shots-to-cost-3-to-10-under-african-union-vaccine-plan-20210120; https://www.reuters.com/article/uk-health-coronavirus-africa/african-union-secures-270-million-covid-19-vaccine-doses-from-manufacturers-idUSKBN29J0OW
http://www.thepresidency.gov.za/newsletters/africa-centres-disease-control-and-prevention-secures-first-tranche-covid-vaccines"
Gamaleya,Russian Federation,Approved,2,Multilateral Purchase,Yes,,,300.000,May-21,2925.00, 9.75 ,African Union,0,Lower middle income," 1,822.20 "," 2,373,996,740,642.72 "," 1,302,819,408.00 ",1302.82,0.230,11.51%,"Price/dose used to calculated total price. Russia is reportedly also offering to provide a financing package for interested AU Member States. GNI/population calculated without Saharawi due to lack of World Bank data. The data, however, includes Burundi and Tanzania - two countries which have refused COVID vaccines as of now. ",https://www.reuters.com/article/health-coronavirus-africa/update-2-african-union-says-russia-offers-300-mln-doses-of-sputnik-v-vaccine-idUSL8N2KP2TH ; https://www.ft.com/content/ffe40c7d-c418-4a93-a202-5ee996434de7
Johnson & Johnson,United States/Belgium,Approved,1,Multilateral Purchase,Yes,,,220.000,At least 50 million doses will be available from April to June 2021,2200.00, 10.00 ,African Union,0,Lower middle income," 1,822.20 "," 2,373,996,740,642.72 "," 1,302,819,408.00 ",1302.82,0.169,16.89%,"African Union will have option to order an additional 180m doses through 2022. GNI/population calculated without Saharawi Arab Democratic Republic due to lack of World Bank data. The data, however, includes Burundi and Tanzania - two countries which have refused COVID vaccines as of now. 10 USD/dose estimate provided in news reports used to estimate total price.","https://www.news24.com/citypress/business/covid-19-shots-to-cost-3-to-10-under-african-union-vaccine-plan-20210120; https://www.reuters.com/article/uk-health-coronavirus-africa/african-union-secures-270-million-covid-19-vaccine-doses-from-manufacturers-idUSKBN29J0OW
http://www.thepresidency.gov.za/newsletters/africa-centres-disease-control-and-prevention-secures-first-tranche-covid-vaccines ; https://www.jnj.com/johnson-johnson-announces-advance-purchase-agreement-with-the-african-vaccine-acquisition-trust-for-the-companys-covid-19-vaccine-candidate"
Pfizer/BioNTech,United States/Germany,Approved,2,Multilateral Purchase,Yes,,,50.000,At least 50 million doses will be available from April to June 2021,337.50, 6.75 ,African Union,0,Lower middle income," 1,822.20 "," 2,373,996,740,642.72 "," 1,302,819,408.00 ",1302.82,0.038,1.92%,"GNI/population calculated without Saharawi due to lack of World Bank data. The data, however, includes Burundi and Tanzania - two countries which have refused COVID vaccines as of now. 6.75 USD/dose reported scaled up to provide estimated total price.","https://www.reuters.com/article/us-health-coronavirus-j-j-vaccine/jj-agrees-to-supply-african-union-with-up-to-400-million-covid-shots-idUSKBN2BL0QS ; https://www.news24.com/citypress/business/covid-19-shots-to-cost-3-to-10-under-african-union-vaccine-plan-20210120; https://www.reuters.com/article/uk-health-coronavirus-africa/african-union-secures-270-million-covid-19-vaccine-doses-from-manufacturers-idUSKBN29J0OW
http://www.thepresidency.gov.za/newsletters/africa-centres-disease-control-and-prevention-secures-first-tranche-covid-vaccines"
Gamaleya,Russian Federation,Approved,2,Government Purchase,Yes,,,NA,,Not available,,Albania,Europe & Central Asia,Upper middle income," 5,220.00 "," 14,906,826,613.21 "," 2,854,191.00 ",2.85,#VALUE!,#VALUE!,"Reports suggest that Albania has received doses from Gamaleya but the details of the agreement are unavailable. AP reports a total purchase of 2.5m doses from Pfizer, Gamaleya, Sinovac and AstraZeneca.",https://www.reuters.com/article/us-health-coronavirus-albania-vaccines/albania-gets-192000-doses-of-chinese-sinovac-vaccine-idUSKBN2BH2N9 ; https://apnews.com/article/tirana-albania-europe-coronavirus-pandemic-coronavirus-vaccine-1b00c50e0b04984dcfe5075982b71b0c
Pfizer/BioNTech,United States/Germany,Approved,2,Government Purchase,Yes,,,0.500,January and February 2021,Not available,,Albania,Europe & Central Asia,Upper middle income," 5,220.00 "," 14,906,826,613.21 "," 2,854,191.00 ",2.85,0.175,8.76%,"Contract will not be made public ""due to confidentiality clauses""",https://euronews.al/en/daily-news/2021/01/15/albania-to-keep-vaccine-agreement-with-pfizer-and-biontech-secret ; https://seenews.com/news/albania-strikes-deal-with-pfizer-for-500000-covid-19-vaccines-726604
Sinovac,China,Approved,2,Government Purchase,Yes,,,1.000,Mar-21,Not available,,Albania,Europe & Central Asia,Upper middle income," 5,220.00 "," 14,906,826,613.21 "," 2,854,191.00 ",2.85,0.350,17.52%,Agreement announced after Albania started receiving shipments of the vaccine. Option for an additional purchase of 0.5m doses,https://www.reuters.com/article/us-health-coronavirus-albania-vaccines/albania-gets-192000-doses-of-chinese-sinovac-vaccine-idUSKBN2BH2N9
AstraZeneca/Oxford,United Kingdom/Sweden,Approved,2,Government Purchase,Yes,Serum Institute,India,0.800,Jan-21,Not available,,Algeria,Middle East & North Africa,Lower middle income," 4,010.00 "," 172,476,083,947.37 "," 43,053,054.00 ",43.05,0.019,0.93%,0.05m doses delivered in Jan 2021,https://www.dzbreaking.com/2021/02/16/covid-19-algeria-to-purchase-800000-doses-of-atrazeneca-vaccine-from-indian-laboratory/
Gamaleya,Russian Federation,Approved,2,Government Purchase,Yes,,,NA,,Not available, 9.75 ,Algeria,Middle East & North Africa,Lower middle income," 4,010.00 "," 172,476,083,947.37 "," 43,053,054.00 ",43.05,#VALUE!,#VALUE!,,https://www.aljazeera.com/news/2020/12/31/bolivia-algeria-sign-vaccine-deals-for-russias-sputnik-v ; https://www.ft.com/content/ffe40c7d-c418-4a93-a202-5ee996434de7
AstraZeneca/Oxford,United Kingdom/Sweden,Approved,2,Government Purchase,Yes,Serum Institute,India,0.580,Feb-21,Not available,,Argentina,Latin America & Caribbean,Upper middle income," 11,130.00 "," 500,111,583,144.61 "," 44,938,712.00 ",44.94,0.013,0.65%,,https://www.financialexpress.com/lifestyle/health/vaccine-maitri-diplomacy-more-latin-american-countries-to-get-covid-vaccine-doses-from-india/2194625/ ; https://www.reuters.com/article/health-coronavirus-argentina-vaccine-idUSKBN2AH07M
Gamaleya,Russian Federation,Approved,2,Government Purchase,Yes,,,10.000,January and February 2021,Not available, 9.75 ,Argentina,Latin America & Caribbean,Upper middle income," 11,130.00 "," 500,111,583,144.61 "," 44,938,712.00 ",44.94,0.223,11.13%,"Sources differ on number of doses agreed to. A press release from the Gamaleya institute says 10 million doses (dated December 10, and earlier reporting from Reuters says 10 as well. However, other reporting says 25 million doses, or enough to vaccinate 10 million Argentinians (which would be at least 20 million doses)",https://www.reuters.com/article/us-health-coronavirus-argentina-vaccine/argentina-expects-10-million-doses-of-russian-covid-19-vaccine-idUSKBN27I2SG ; https://sputnikvaccine.com/newsroom/pressreleases/rdif-and-government-of-argentina-agree-to-supply-10-million-doses-of-the-sputnik-v-vaccine/ ; https://tribune.com.pk/story/2275592/argentina-inks-deal-with-russia-for-sputnik-v-covid-19-vaccine ; https://www.ft.com/content/ffe40c7d-c418-4a93-a202-5ee996434de7
Sinopharm/Beijing,China,Approved,2,Government Purchase,Yes,,,1.000,End of Feb-21,20.00, 20.00 ,Argentina,Latin America & Caribbean,Upper middle income," 11,130.00 "," 500,111,583,144.61 "," 44,938,712.00 ",44.94,0.022,1.11%,Price provided in terms of price per two doses (40 USD); that price used to calculate price/dose and total price. Option to purchase an additional 29m doses.,https://www.infobae.com/politica/2021/02/09/el-gobierno-cerro-el-acuerdo-para-comprar-vacunas-chinas-y-aguarda-la-autorizacion-de-la-anmat-para-traer-un-millon-de-dosis/ ; https://www.batimes.com.ar/news/argentina/shipment-of-900000-sinopharm-vaccine-doses-arrives-in-argentina.phtml
Gamaleya,Russian Federation,Approved,2,Government Purchase,Yes,,,1.000,,9.75, 9.75 ,Armenia,Europe & Central Asia,Upper middle income," 4,680.00 "," 13,834,503,213.99 "," 2,957,731.00 ",2.96,0.338,16.90%,Price based on RDIF's statement that the vaccine is being sold in all markets for 9.75 USD/dose.,https://www.reuters.com/business/healthcare-pharmaceuticals/armenia-receive-1-mln-doses-russias-sputnik-v-shot-tass-2021-04-14/ ; https://www.ft.com/content/ffe40c7d-c418-4a93-a202-5ee996434de7
Moderna,United States,Approved,2,Government Purchase,Yes,,,25.000,,Not available,,Australia,East Asia & Pacific,High income," 55,100.00 "," 1,397,555,434,163.32 "," 25,364,307.00 ",25.36,0.986,49.28%,"Moderna will supply 10m doses this year, against the original strain and 15m does in 2022 against the new variants as booster candidate. Supply of the updated doses are subject to approval",https://www.reuters.com/business/healthcare-pharmaceuticals/moderna-deliver-25-million-covid-19-vaccine-doses-australia-2021-05-12/
AstraZeneca/Oxford,United Kingdom/Sweden,Approved,2,Combination,Yes,CSL,Australia,53.800,3.8m doses by early 2021,Not available,,Australia,East Asia & Pacific,High income," 55,100.00 "," 1,397,555,434,163.32 "," 25,364,307.00 ",25.36,2.121,106.05%,"Australian biotech company CSL will manufacture 50m doses of the vaccine in monthly batches (originally at 30m manufacturing, an additional 20m was added to the deal in Dec 2020)",https://www.health.gov.au/initiatives-and-programs/covid-19-vaccines/about-covid-19-vaccines/australias-vaccine-agreements; https://www.theguardian.com/australia-news/2020/sep/06/australian-government-announces-covid-vaccine-deals-to-provide-848m-doses; https://www.abc.net.au/news/2020-08-18/australia-locks-in-oxford-astrazeneca-coronavirus-vaccine-deal/12571454 ; https://s3.amazonaws.com/one.org/vaccine-access-test/ONE_VAT_deal_AstraZeneca_Australia.pdf
Novavax,United States,Phase 3,2,Government Purchase,Yes,,,51.000,Early to mid 2021,Not available,,Australia,East Asia & Pacific,High income," 55,100.00 "," 1,397,555,434,163.32 "," 25,364,307.00 ",25.36,2.011,100.53%,"The 51m doses agreement follows an initial, smaller agreement in November. Australia will have the option to purchase an additional 10 million doses",https://www.health.gov.au/initiatives-and-programs/covid-19-vaccines/about-covid-19-vaccines/australias-vaccine-agreements; https://www.pm.gov.au/media/australia-secures-further-50-million-doses-covid-19-vaccine
Pfizer/BioNTech,United States/Germany,Approved,2,Government Purchase,Yes,,,40.000,Early to mid 2021,Not available,,Australia,East Asia & Pacific,High income," 55,100.00 "," 1,397,555,434,163.32 "," 25,364,307.00 ",25.36,1.577,78.85%,"Initial purchase of 10m followed by another 10m in Feb 2021, followed by purchase of 20m in Apr 2021",https://www.pm.gov.au/media/australia-secures-further-50-million-doses-covid-19-vaccine ; https://www.health.gov.au/news/10-million-additional-pfizer-biontech-vaccines-secured; https://www.reuters.com/article/us-health-coronavirus-australia-pfizer/australia-to-purchase-20-million-more-doses-of-pfizers-covid-19-vaccine-pm-idUSKBN2BW0AA?il=0
University of Queensland/CSL,Australia,Terminated,2,Government Purchase,Terminated,CSL,Australia,51.000,Mid-2021,Not available,,Australia,East Asia & Pacific,High income," 55,100.00 "," 1,397,555,434,163.32 "," 25,364,307.00 ",25.36,2.011,100.53%,,https://www.csl.com/news/2020/20200907-csl-to-manufacture-and-supply-uq-and-ou-vaccine-candidates-for-australia; https://www.theguardian.com/world/2020/dec/11/australia-terminates-university-of-queensland-vaccine-deal-with-csl-after-false-positives-for-hiv
Gamaleya,Russian Federation,Approved,2,Government Purchase,No,,,1.000,"300,000 in April, 500,000 in May, and 200,000 in June 2021",Not available,,Austria,Europe & Central Asia,High income," 51,460.00 "," 456,779,629,694.87 "," 8,877,067.00 ",8.88,0.113,5.63%,"Talks are ongoing and have not been finalized as of March 30, 2021",https://www.politico.eu/article/austria-in-talks-with-russia-for-1m-sputnik-vaccine-doses/
Gamaleya,Russian Federation,Approved,2,Government Purchase,Yes,,,0.300,,2.93, 9.75 ,Azerbaijan,Europe & Central Asia,Upper middle income," 4,480.00 "," 44,873,711,541.17 "," 10,023,318.00 ",10.02,0.030,1.50%,,https://caspiannews.com/news-detail/azerbaijan-confirms-purchase-of-astrazeneca-and-sputnik-v-vaccines-2021-3-12-5/ ; https://nk.gov.az/az/document/5207/
Sinovac,China,Approved,2,Government Purchase,Yes,,,9.000,Jan-21,Not available,,Azerbaijan,Europe & Central Asia,Upper middle income," 4,480.00 "," 44,873,711,541.17 "," 10,023,318.00 ",10.02,0.898,44.90%,"First agreement signed through Turkey for 4m doses, where the doses would first be delivered to Turkey, checked and then transported to Azerbaijan. New agreement signed for 5m doses with China bringing the total to 9m doses",https://oc-media.org/azerbaijan-starts-rolling-out-chinas-sinovac-vaccine/
Sinopharm/Beijing,China,Approved,2,Government Purchase,Yes,,,0.300,Mar-21,Not available,,Bahrain,Middle East & North Africa,High income," 22,110.00 "," 36,288,393,542.74 "," 1,641,172.00 ",1.64,0.183,9.14%,"Total doses purchased unavailble, but 0.3m doses have been delivered. Bahrain had previously hosted clinical trials of the vaccine.",http://www.chinadaily.com.cn/a/202103/13/WS604c2a24a31024ad0baaef7a.html
Pfizer/BioNTech,United States/Germany,Approved,2,Government Purchase,Yes,,,NA,Starting Dec 2020,Not available,,Bahrain,Middle East & North Africa,High income," 22,110.00 "," 36,288,393,542.74 "," 1,641,172.00 ",1.64,#VALUE!,#VALUE!,Details of the agreement have not been made public but vaccine rollout has already begun,https://www.reuters.com/article/health-coronavirus-vaccine-bahrain-int-idUSKBN2BH1FF ; https://www.arabnews.com/node/1793561/middle-east
AstraZeneca/Oxford,United Kingdom/Sweden,Approved,2,Government Purchase,Yes,Serum Institute [manufacturer]; Beximco [Bangladesh] [distributor],India,30.000,,120.00, 4.00 ,Bangladesh,South Asia,Lower middle income," 1,940.00 "," 316,235,042,683.12 "," 163,046,161.00 ",163.05,0.184,9.20%,"Beximco purchasing at 4 USD/dose for Bangladeshi government ""at first"" but will, over some unspecified period of time, decrease to the rate that the Indian government is paying. ",https://www.reuters.com/article/us-health-coronavirus-bangladesh-vaccine/exclusive-bangladeshs-beximco-could-start-private-sales-of-astrazeneca-vaccine-next-month-idUKKBN29H1YC
AstraZeneca/Oxford,United Kingdom/Sweden,Approved,2,Private Purchase,Yes,Serum Institute [manufacturer]; Beximco [Bangladesh] [distributor],India,1.000,,8.00, 8.00 ,Bangladesh,South Asia,Lower middle income," 1,940.00 "," 316,235,042,683.12 "," 163,046,161.00 ",163.05,0.006,0.31%,"Will be provided for private sale in Bangladesh, for 13.27 USD/dose. Option to add another 2m doses. Price paid was put at estimated 8 USD/dose, used to estimate total price",https://www.reuters.com/article/us-health-coronavirus-bangladesh-vaccine/exclusive-bangladeshs-beximco-could-start-private-sales-of-astrazeneca-vaccine-next-month-idUKKBN29H1YC
Gamaleya,Russian Federation,Approved,2,Combination,Yes,Belpharmprom,Belarus,0.100,,0.98, 9.75 ,Belarus,Europe & Central Asia,Upper middle income," 6,290.00 "," 59,501,934,102.27 "," 9,466,856.00 ",9.47,0.011,0.53%,Belarus is starting roll out with 0.1m doses in March 2021.  Not clear if additional doses have been purchased. ,https://eng.belta.by/society/view/belarus-to-roll-out-first-commercial-batch-of-sputnik-v-in-mid-april-138660-2021/; https://sputnikvaccine.com/newsroom/pressreleases/belarus-starts-vaccination-with-sputnik-v-/ ; https://www.ft.com/content/ffe40c7d-c418-4a93-a202-5ee996434de7
Sinovac,China,Approved,2,Government Purchase,Yes,,,0.103,,Not available,,Benin,Sub-Saharan Africa,Lower middle income," 1,250.00 "," 14,799,214,859.05 "," 11,801,151.00 ",11.80,0.009,0.44%,Benin has also received a roughly equivalent donation of Sinovac vaccines from China.,https://www.gouv.bj/actualite/1226/lutte-contre-pandemie-coronavirus--covid-19-benin-recu-203.000-doses-vaccins-chine/
AstraZeneca/Oxford,United Kingdom/Sweden,Approved,2,Government Purchase,Yes,Serum Institute,India,5.000,April 2021 (for first 1m),Not available,,Bolivia,Latin America & Caribbean,Lower middle income," 3,520.00 "," 40,563,574,718.82 "," 11,513,100.00 ",11.51,0.434,21.71%,,https://www.reuters.com/article/healthbolivia-india/bolivia-signs-contract-with-indias-serum-institute-for-5-million-astrazeneca-vaccine-doses-idUSKBN29I28V
Gamaleya,Russian Federation,Approved,2,Government Purchase,Yes,,,2.600,All shipped by May 2021,25.35, 9.75 ,Bolivia,Latin America & Caribbean,Lower middle income," 3,520.00 "," 40,563,574,718.82 "," 11,513,100.00 ",11.51,0.226,11.29%,"Some reporting puts the number of total doses at 5.2m doses, but the RDIF reports 2.6. Price estimated at 10/dose; this estimate used to calculate total price.","https://www.reuters.com/article/us-health-coronavirus-latam-russia-insig/amid-scramble-for-covid-19-vaccine-latin-america-turns-to-russia-idUSKCN2AT23J ; https://sputnikvaccine.com/newsroom/pressreleases/rdif-to-supply-2-6-million-doses-of-russian-sputnik-v-coronavirus-vaccine-to-bolivia/, https://www.aljazeera.com/news/2020/12/31/bolivia-algeria-sign-vaccine-deals-for-russias-sputnik-v ; https://www.ft.com/content/ffe40c7d-c418-4a93-a202-5ee996434de7"
Sinopharm/Beijing,China,Approved,2,Government Purchase,Yes,,,0.400,End-Feb 2021,Not available,,Bolivia,Latin America & Caribbean,Lower middle income," 3,520.00 "," 40,563,574,718.82 "," 11,513,100.00 ",11.51,0.035,1.74%,,https://cnnespanol.cnn.com/2021/02/11/gobierno-de-bolivia-llega-a-acuerdo-con-sinopharm-para-adquisicion-de-500-000-vacunas-contra-covid-19/ ; https://as.com/diarioas/2021/02/12/actualidad/1613164666_711512.html
Johnson & Johnson,United States/Belgium,Approved,1,Government Purchase,No,,,15.000,,52.50, 3.50 ,Bolivia,Latin America & Caribbean,Lower middle income," 3,520.00 "," 40,563,574,718.82 "," 11,513,100.00 ",11.51,1.303,130.29%,"Bolovia's agreement is conditional on WTO's patent waiver, and that the Canadian manufacturer Biolyse Pharma Corp would make the doses. Not listed as manufacturer since the patent waiver has not been approved to date. Total price based on estimate that the medicine would cost between 3 and 4 USD per dose (3.5 USD used here for calculations).",https://www.reuters.com/world/americas/bolivia-signs-jj-vaccine-deal-with-twist-someone-else-would-make-it-2021-05-11/
Gamaleya,Russian Federation,Approved,2,Government Purchase,Yes,,,0.500,,4.89,9.75,Bosnia and Herzegovina,Europe & Central Asia,Upper middle income," 6,170.00 "," 20,375,253,236.72 "," 3,301,000.00 ",3.30,0.151,7.57%,Price based on Gamaleya's statement that the vaccine is being sold in all markets for 9.75 USD/dose.,https://www.reuters.com/article/health-coronavirus-bosnia-vaccine-idCNL8N2LF368
Gamaleya,Russian Federation,Approved,2,Government Purchase,Yes,,,0.400,,3.90, 9.75 ,Bosnia and Herzegovina,Europe & Central Asia,Upper middle income," 6,170.00 "," 20,375,253,236.72 "," 3,301,000.00 ",3.30,0.121,6.06%,Purchase by Bosnia's autonomous Serb dominated region. Price based on Gamaleya's statement that the vaccine is being sold in all markets for 9.75 USD/dose.,https://www.reuters.com/article/health-coronavirus-bosnia-vaccines/bosnia-begins-covid-19-vaccination-roll-out-with-russian-vaccine-idUSL8N2KI2RI
Sinopharm/Beijing,China,Approved,2,Government Purchase,Yes,,,NA,,Not available,,Bosnia and Herzegovina,Europe & Central Asia,Upper middle income," 6,170.00 "," 20,375,253,236.72 "," 3,301,000.00 ",3.30,#VALUE!,#VALUE!,Doses purchased is unknown. Bosnia announced in Jan that it plans to purchase the Sinopharm vaccine. A purchase order has only been reported by one Xinhuanet,http://www.xinhuanet.com/english/europe/2021-02/09/c_139732362.htm
Sinovac,China,Approved,2,Government Purchase,Yes,,,0.200,,Not available,,Botswana,Sub-Saharan Africa,Upper middle income," 7,650.00 "," 17,629,591,427.69 "," 2,303,697.00 ",2.30,0.087,4.34%,"Botswana has also received a donation of 200,000 doses from China.",https://africa.cgtn.com/2021/04/23/botswana-to-receive-donation-of-covid-19-vaccines-from-china/
AstraZeneca/Oxford,United Kingdom/Sweden,Approved,2,Government Purchase,Yes,Serum Institute,India,12.000,Early Jan 2021,Not available,,Brazil,Latin America & Caribbean,Upper middle income," 9,130.00 "," 1,926,332,314,781.08 "," 211,049,527.00 ",211.05,0.057,2.84%,"Part of a diplomatic push, the deal is made through the govt of India, where Brazil is apparently getting a 'special price'. Brazil is reported to be a sending a plane to India to expedite the delivery of shots so it can start its mass vaccination program. But the shipment was delayed due to export approval issues from the Indian govt. Further 10m doses negotiated since then.",https://www.bio.fiocruz.br/index.php/br/noticias/2218-2-milhoes-de-doses-devem-estar-liberados-na-madrugada-desta-quarta; https://www.reuters.com/article/health-coronavirus-brazil-astrazeneca/brazil-sends-plane-to-obtain-2-million-doses-of-astrazenecas-covid-19-vaccine-idUSL1N2JO1P3 ; https://www.reuters.com/article/us-health-coronavirus-brazil-india/brazil-scrambles-for-india-made-vaccines-to-jumpstart-inoculations-idUSKBN2991IJ
AstraZeneca/Oxford,United Kingdom/Sweden,Approved,2,Combination,Yes,Fiocruz,Brazil,260.400,,942.65, 3.62 ,Brazil,Latin America & Caribbean,Upper middle income," 9,130.00 "," 1,926,332,314,781.08 "," 211,049,527.00 ",211.05,1.234,61.69%,"Initial deal for 30m finished doses and 70m unfinished doses to be finished by Fiocruz and provided at no cost estimated at 127m USD. Later licensing and purchasing deal for 100 m doses was set at 362 m USD, although not confirmed by Brazil or AstraZeneca. Deal later increased to 260.4m doses; price scaled up based on estimate for the 100m doses.",https://www.gov.br/saude/pt-br/assuntos/noticias/governo-federal-ja-garantiu-300-milhoes-de-doses-de-vacinas-contra-a-covid-19-para-2021 ; https://www.aljazeera.com/news/2021/1/4/brazil-scrambles-to-secure-covid-vaccine-from-india; https://www.fiercepharma.com/manufacturing/astrazeneca-to-supply-millions-covid-19-shot-to-brazilian-government-swamped-by-new ; https://s3.amazonaws.com/one.org/vaccine-access-test/ONE_VAT_deal_AstraZeneca_Brazil_August_11.pdf
Bharat Biotech,India,Approved,2,Private Purchase,No,,,5.000,,Not available,,Brazil,Latin America & Caribbean,Upper middle income," 9,130.00 "," 1,926,332,314,781.08 "," 211,049,527.00 ",211.05,0.024,1.18%,Purchase deal reached with private clinics in Brazil - the Brazilian Association of Vaccine Clinics.,"https://www.reuters.com/article/us-health-coronavirus-brazil-vaccine/brazilian-clinics-to-buy-indias-covaxin-vaccine-pending-approval-idUSKBN29I214 ; https://www.reuters.com/article/us-health-coronavirus-brazil-india/brazil-scrambles-for-india-made-vaccines-to-jumpstart-inoculations-idUSKBN2991IJ
"
